{
  "$schema": "http://json-schema.org/draft-07/schema#",
  "$id": "https://velo-text.dev/schemas/portable-doc-v1.json",
  "title": "PortableDocument v1",
  "type": "object",
  "required": ["schema", "schemaVersion", "id", "revision", "locale", "direction", "createdAt", "updatedAt", "metadata", "page", "root", "assets"],
  "properties": {
    "schema": { "const": "portable-doc" },
    "schemaVersion": { "const": 1 },
    "id": { "type": "string", "minLength": 1 },
    "revision": { "type": "integer", "minimum": 0 },
    "locale": { "type": "string", "examples": ["es-AR", "en-US"] },
    "direction": { "enum": ["ltr", "rtl", "auto"] },
    "createdAt": { "type": "string", "format": "date-time" },
    "updatedAt": { "type": "string", "format": "date-time" },
    "metadata": { "type": "object" },
    "page": {
      "type": "object",
      "required": ["widthUm", "heightUm", "marginUm"],
      "properties": {
        "widthUm": { "type": "integer", "minimum": 1 },
        "heightUm": { "type": "integer", "minimum": 1 },
        "marginUm": {
          "type": "object",
          "required": ["top", "right", "bottom", "left"],
          "properties": {
            "top": { "type": "integer", "minimum": 0 },
            "right": { "type": "integer", "minimum": 0 },
            "bottom": { "type": "integer", "minimum": 0 },
            "left": { "type": "integer", "minimum": 0 }
          }
        },
        "headerFooter": { "$ref": "#/definitions/headerFooterConfig" }
      }
    },
    "root": {
      "type": "object",
      "required": ["type", "id", "children"],
      "properties": {
        "type": { "const": "root" },
        "id": { "type": "string" },
        "children": { "type": "array", "items": { "$ref": "#/definitions/blockNode" } }
      }
    },
    "assets": {
      "type": "object",
      "additionalProperties": { "$ref": "#/definitions/assetRef" }
    },
    "footnotes": {
      "type": "object",
      "additionalProperties": {
        "type": "object",
        "required": ["id", "blocks"],
        "properties": {
          "id": { "type": "string" },
          "blocks": { "type": "array", "items": { "$ref": "#/definitions/blockNode" } }
        }
      }
    }
  },
  "definitions": {
    "textMarks": {
      "type": "object",
      "properties": {
        "bold": { "type": "boolean" },
        "italic": { "type": "boolean" },
        "underline": { "type": "boolean" },
        "strike": { "type": "boolean" },
        "code": { "type": "boolean" },
        "color": { "type": "string", "pattern": "^#([0-9A-Fa-f]{6}|[0-9A-Fa-f]{8})$" },
        "background": { "type": "string" },
        "fontSizePt": { "type": "number" },
        "fontFamily": { "type": "string" }
      }
    },
    "inlineNode": {
      "oneOf": [
        { "$ref": "#/definitions/textNode" },
        { "$ref": "#/definitions/variableNode" },
        { "$ref": "#/definitions/linkNode" },
        { "$ref": "#/definitions/inlineImageNode" },
        { "$ref": "#/definitions/hardBreakNode" },
        { "$ref": "#/definitions/inlineEquationNode" },
        { "$ref": "#/definitions/footnoteRefInlineNode" }
      ]
    },
    "textNode": {
      "type": "object",
      "required": ["type", "id", "text"],
      "properties": {
        "type": { "const": "text" },
        "id": { "type": "string" },
        "text": { "type": "string" },
        "marks": { "$ref": "#/definitions/textMarks" }
      }
    },
    "variableNode": {
      "type": "object",
      "required": ["type", "id", "path", "source", "valueType"],
      "properties": {
        "type": { "const": "variable" },
        "id": { "type": "string" },
        "path": { "type": "string", "pattern": "^[a-zA-Z_][a-zA-Z0-9_]*(\\.[a-zA-Z_][a-zA-Z0-9_]*|\\[\\d+\\])*$" },
        "source": { "type": "string" },
        "valueType": { "enum": ["string", "number", "date", "boolean", "image", "unknown"] },
        "format": { "type": "string" },
        "fallback": { "type": "string" },
        "marks": { "$ref": "#/definitions/textMarks" }
      }
    },
    "linkNode": {
      "type": "object",
      "required": ["type", "id", "href", "children"],
      "properties": {
        "type": { "const": "link" },
        "id": { "type": "string" },
        "href": { "type": "string" },
        "children": { "type": "array", "items": { "$ref": "#/definitions/textNode" } }
      }
    },
    "inlineImageNode": {
      "type": "object",
      "required": ["type", "id", "assetId"],
      "properties": {
        "type": { "const": "inline-image" },
        "id": { "type": "string" },
        "assetId": { "type": "string" }
      }
    },
    "hardBreakNode": {
      "type": "object",
      "required": ["type", "id"],
      "properties": {
        "type": { "const": "hard-break" },
        "id": { "type": "string" }
      }
    },
    "inlineEquationNode": {
      "type": "object",
      "required": ["type", "id", "latex"],
      "properties": {
        "type": { "const": "equation" },
        "id": { "type": "string" },
        "latex": { "type": "string", "minLength": 1, "maxLength": 2000 },
        "display": { "type": "boolean" }
      }
    },
    "footnoteRefInlineNode": {
      "type": "object",
      "required": ["type", "id", "footnoteId"],
      "properties": {
        "type": { "const": "footnote-ref" },
        "id": { "type": "string" },
        "footnoteId": { "type": "string" },
        "customMark": { "type": "string" }
      }
    },
    "blockNode": {
      "oneOf": [
        { "$ref": "#/definitions/paragraphNode" }, { "$ref": "#/definitions/headingNode" }, { "$ref": "#/definitions/quoteNode" },
        { "$ref": "#/definitions/listNode" }, { "$ref": "#/definitions/tableNode" }, { "$ref": "#/definitions/imageBlockNode" },
        { "$ref": "#/definitions/pageBreakNode" }, { "$ref": "#/definitions/horizontalRuleNode" }, { "$ref": "#/definitions/equationBlockNode" },
        { "$ref": "#/definitions/columnsNode" }, { "$ref": "#/definitions/sectionBreakBlockNode" }, { "$ref": "#/definitions/tableOfContentsBlockNode" },
        { "$ref": "#/definitions/codeBlockNode" }, { "$ref": "#/definitions/calloutBlockNode" }
      ]
    },
    "paragraphNode": {
      "type": "object",
      "required": ["type", "id", "children"],
      "properties": {
        "type": { "const": "paragraph" },
        "id": { "type": "string" },
        "children": { "type": "array", "items": { "$ref": "#/definitions/inlineNode" } },
        "align": { "enum": ["left", "center", "right", "justify"] }
      }
    },
    "headingNode": {
      "type": "object",
      "required": ["type", "id", "level", "children"],
      "properties": {
        "type": { "const": "heading" },
        "id": { "type": "string" },
        "level": { "enum": [1, 2, 3, 4, 5, 6] },
        "children": { "type": "array", "items": { "$ref": "#/definitions/inlineNode" } }
      }
    },
    "quoteNode": {
      "type": "object",
      "required": ["type", "id", "children"],
      "properties": {
        "type": { "const": "quote" },
        "id": { "type": "string" },
        "children": { "type": "array", "items": { "$ref": "#/definitions/inlineNode" } }
      }
    },
    "listNode": {
      "type": "object",
      "required": ["type", "id", "kind", "items"],
      "properties": {
        "type": { "const": "list" },
        "id": { "type": "string" },
        "kind": { "enum": ["ordered", "unordered"] },
        "items": { "type": "array", "items": { "$ref": "#/definitions/listItem" } }
      }
    },
    "listItem": {
      "type": "object",
      "required": ["id", "content"],
      "properties": {
        "id": { "type": "string" },
        "content": { "type": "array", "items": { "$ref": "#/definitions/inlineNode" } },
        "checked": { "type": "boolean" }
      }
    },
    "tableNode": {
      "type": "object",
      "required": ["type", "id", "columns", "rows"],
      "properties": {
        "type": { "const": "table" },
        "id": { "type": "string" },
        "columns": { "type": "array" },
        "rows": { "type": "array" }
      }
    },
    "imageBlockNode": {
      "type": "object",
      "required": ["type", "id", "assetId"],
      "properties": {
        "type": { "const": "image" },
        "id": { "type": "string" },
        "assetId": { "type": "string" }
      }
    },
    "pageBreakNode": {
      "type": "object",
      "required": ["type", "id"],
      "properties": {
        "type": { "const": "page-break" },
        "id": { "type": "string" }
      }
    },
    "horizontalRuleNode": {
      "type": "object",
      "required": ["type", "id"],
      "properties": { "type": { "const": "horizontal-rule" }, "id": { "type": "string" } }
    },
    "equationBlockNode": {
      "type": "object",
      "required": ["type", "id", "latex"],
      "properties": {
        "type": { "const": "equation-block" },
        "id": { "type": "string" },
        "latex": { "type": "string", "minLength": 1, "maxLength": 2000 }, "label": { "type": "string" }
      }
    },
    "columnsNode": {
      "type": "object",
      "required": ["type", "id", "columns"],
      "properties": { "type": { "const": "columns" }, "id": { "type": "string" }, "columns": { "type": "array" }, "gapUm": { "type": "integer" } }
    },
    "sectionBreakBlockNode": {
      "type": "object",
      "required": ["type", "id"],
      "properties": {
        "type": { "const": "section-break" },
        "id": { "type": "string" },
        "settings": {
          "type": "object",
          "properties": {
            "orientation": { "enum": ["portrait", "landscape"] },
            "widthUm": { "type": "integer", "minimum": 1 },
            "heightUm": { "type": "integer", "minimum": 1 },
            "marginsUm": {
              "type": "object",
              "properties": {
                "top": { "type": "integer", "minimum": 0 },
                "right": { "type": "integer", "minimum": 0 },
                "bottom": { "type": "integer", "minimum": 0 },
                "left": { "type": "integer", "minimum": 0 }
              }
            },
            "restartPageNumbering": { "type": "boolean" },
            "startPageNumber": { "type": "integer", "minimum": 1 }
          }
        }
      }
    },
    "tableOfContentsBlockNode": {
      "type": "object",
      "required": ["type", "id"],
      "properties": {
        "type": { "const": "table-of-contents" },
        "id": { "type": "string" },
        "maxDepth": { "type": "integer", "minimum": 1, "maximum": 6 },
        "leaderStyle": { "enum": ["dots", "line", "none"] }
      }
    },
    "assetRef": {
      "type": "object",
      "required": ["id", "kind", "mediaType", "storageKey", "sha256", "byteLength", "alt"],
      "properties": {
        "id": { "type": "string" },
        "kind": { "const": "image" },
        "mediaType": { "enum": ["image/png", "image/jpeg", "image/webp", "image/svg+xml"] },
        "storageKey": { "type": "string" },
        "sha256": { "type": "string", "pattern": "^[a-f0-9]{64}$" },
        "byteLength": { "type": "integer", "minimum": 0 },
        "alt": { "type": "string" }
      }
    },
    "headerFooterZone": {
      "type": "object",
      "properties": {
        "left": { "type": "array", "items": { "$ref": "#/definitions/inlineNode" } },
        "center": { "type": "array", "items": { "$ref": "#/definitions/inlineNode" } },
        "right": { "type": "array", "items": { "$ref": "#/definitions/inlineNode" } }
      }
    },
    "headerFooterConfig": {
      "type": "object",
      "properties": {
        "header": { "$ref": "#/definitions/headerFooterZone" },
        "footer": { "$ref": "#/definitions/headerFooterZone" },
        "firstPageDifferent": { "type": "boolean" },
        "firstPageHeader": { "$ref": "#/definitions/headerFooterZone" },
        "firstPageFooter": { "$ref": "#/definitions/headerFooterZone" },
        "oddEvenDifferent": { "type": "boolean" },
        "evenPageHeader": { "$ref": "#/definitions/headerFooterZone" },
        "evenPageFooter": { "$ref": "#/definitions/headerFooterZone" },
        "headerDistanceUm": { "type": "integer", "minimum": 0 },
        "footerDistanceUm": { "type": "integer", "minimum": 0 }
      }
    },
    "codeBlockNode": {
      "type": "object",
      "required": ["type", "id", "code", "language"],
      "properties": {
        "type": { "const": "code-block" },
        "id": { "type": "string" },
        "code": { "type": "string" },
        "language": {
          "enum": ["typescript", "javascript", "html", "css", "json", "sql", "python", "bash", "plain"]
        },
        "showLineNumbers": { "type": "boolean" },
        "lineStart": { "type": "integer", "minimum": 1 }
      }
    },
    "calloutBlockNode": {
      "type": "object",
      "required": ["type", "id", "variant", "children"],
      "properties": {
        "type": { "const": "callout" },
        "id": { "type": "string" },
        "variant": { "enum": ["info", "tip", "warning", "danger", "note"] },
        "title": { "type": "string" },
        "children": { "type": "array", "items": { "$ref": "#/definitions/blockNode" } }
      }
    }
  }
}
