{
  "schema": "portable-doc",
  "schemaVersion": 1,
  "id": "doc_000001",
  "revision": 0,
  "locale": "es-AR",
  "direction": "ltr",
  "createdAt": "2026-08-27T12:00:00.000Z",
  "updatedAt": "2026-08-27T12:00:00.000Z",
  "metadata": {},
  "page": {
    "widthUm": 210000,
    "heightUm": 297000,
    "marginUm": {
      "top": 20000,
      "right": 20000,
      "bottom": 20000,
      "left": 20000
    }
  },
  "root": {
    "type": "root",
    "id": "root_000002",
    "children": [
      {
        "type": "heading",
        "id": "n_000003",
        "level": 1,
        "children": [
          {
            "type": "text",
            "id": "n_000004",
            "text": "Título 1"
          }
        ]
      },
      {
        "type": "heading",
        "id": "n_000005",
        "level": 2,
        "children": [
          {
            "type": "text",
            "id": "n_000006",
            "text": "Título 2"
          }
        ]
      },
      {
        "type": "heading",
        "id": "n_000007",
        "level": 3,
        "children": [
          {
            "type": "text",
            "id": "n_000008",
            "text": "Título 3"
          }
        ]
      }
    ]
  },
  "assets": {}
}