{
  "schema": "portable-doc",
  "schemaVersion": 1,
  "id": "doc_000001",
  "revision": 0,
  "locale": "es-AR",
  "direction": "ltr",
  "createdAt": "2026-08-27T12:00:00.000Z",
  "updatedAt": "2026-08-27T12:00:00.000Z",
  "metadata": {},
  "page": {
    "widthUm": 210000,
    "heightUm": 297000,
    "marginUm": {
      "top": 20000,
      "right": 20000,
      "bottom": 20000,
      "left": 20000
    }
  },
  "root": {
    "type": "root",
    "id": "root_000002",
    "children": [
      {
        "type": "table",
        "id": "n_000019",
        "columns": [
          {
            "id": "n_000003",
            "widthUm": 50000
          },
          {
            "id": "n_000004",
            "widthUm": 50000
          }
        ],
        "rows": [
          {
            "id": "n_000005",
            "cells": [
              {
                "id": "n_000006",
                "colSpan": 1,
                "rowSpan": 1,
                "blocks": [
                  {
                    "type": "paragraph",
                    "id": "n_000007",
                    "children": [
                      {
                        "type": "text",
                        "id": "n_000008",
                        "text": "A1"
                      }
                    ]
                  }
                ]
              },
              {
                "id": "n_000009",
                "colSpan": 1,
                "rowSpan": 1,
                "blocks": [
                  {
                    "type": "paragraph",
                    "id": "n_000010",
                    "children": [
                      {
                        "type": "text",
                        "id": "n_000011",
                        "text": "B1"
                      }
                    ]
                  }
                ]
              }
            ]
          },
          {
            "id": "n_000012",
            "cells": [
              {
                "id": "n_000013",
                "colSpan": 1,
                "rowSpan": 1,
                "blocks": [
                  {
                    "type": "paragraph",
                    "id": "n_000014",
                    "children": [
                      {
                        "type": "text",
                        "id": "n_000015",
                        "text": "A2"
                      }
                    ]
                  }
                ]
              },
              {
                "id": "n_000016",
                "colSpan": 1,
                "rowSpan": 1,
                "blocks": [
                  {
                    "type": "paragraph",
                    "id": "n_000017",
                    "children": [
                      {
                        "type": "text",
                        "id": "n_000018",
                        "text": "B2"
                      }
                    ]
                  }
                ]
              }
            ]
          }
        ]
      }
    ]
  },
  "assets": {}
}