{
  "schema": "portable-doc",
  "schemaVersion": 1,
  "id": "doc_000001",
  "revision": 0,
  "locale": "es-AR",
  "direction": "ltr",
  "createdAt": "2026-08-27T12:00:00.000Z",
  "updatedAt": "2026-08-27T12:00:00.000Z",
  "metadata": {
    "title": "Reporte",
    "author": "Ana",
    "tags": [
      "a",
      "b"
    ]
  },
  "page": {
    "widthUm": 210000,
    "heightUm": 297000,
    "marginUm": {
      "top": 20000,
      "right": 20000,
      "bottom": 20000,
      "left": 20000
    }
  },
  "root": {
    "type": "root",
    "id": "root_000002",
    "children": [
      {
        "type": "paragraph",
        "id": "n_000003",
        "children": [
          {
            "type": "text",
            "id": "n_000004",
            "text": "Con metadata"
          }
        ]
      }
    ]
  },
  "assets": {}
}